,Last Name,First Name,Address,City,ZIP,Phone,Phone2,email,Member Since,Company,Member Type,Title,Terms,Name,Age
0,Barrera,,Ap #509-7259 Volutpat Road,Vienna,7121,+1 (721) 745-1670,(103) 610-6809,,2013-11-17 04:27:49,Apple Systems,,Dr.,venenatis lacus. Etiam bibendum fermentum metus. Aenean sed pede nec,"Barrera, Dawn",-2.0
1,Ware,Moses,920-6169 Quis Rd.,Springfield,B7X 6A1,(258) 594-8621,(809) 315-8612,mauris Morbi@dignissimtemporarcu org,2015-09-03 14:51:01,Lavasoft,Subscriber,Dr.,"et, rutrum non, hendrerit id, ante. Nunc mauris sapien, cursus","Ware, Moses",3.0
2,Solomon,Mariam,794-8695 Penatibus Road,Maglie,26473,+1 (292) 169-5780,(327) 712-6345,nostra@faucibusMorbivehicula org,2015-04-14 01:08:43,Cakewalk,Elite,,"mauris ipsum porta elit, a feugiat tellus lorem eu metus.","Solomon, Mariam",48.0
3,Freeman,Moses,898-7150 Eu St.,Castelnovo del Friuli,96414,(607) 690-4278,(711) 408-8836,eu.augue@loremeumetus.co.uk,2015-08-11 06:43:17,Sibelius,,,"tellus sem mollis dui, in sodales elit erat vitae risus.","Freeman, Moses",15.0
4,Gates,Abbot,517-1730 A St.,Herstappe,528650,(946) 204-6537,NULL,arcu.iaculis@tristiqueneque.org,2015-09-25 16:17:02,Adobe,"Elite, Platinum",Mr.,"ac sem ut dolor dapibus gravida. Aliquam tincidunt, nunc ac","Gates, Abbot",15.0
5,Powers,,4038 Tempus Rd.,Trazegnies,JN47 1RS,+1 (436) 586-8748,(572) 176-9688,orci.luctus@Nuncquisarcu.com,2014-02-21 11:59:46,Lycos,,,"amet, consectetuer adipiscing elit. Curabitur sed tortor. Integer aliquam adipiscing",,70.0
6,Weber,Benedict,1920 Curae; Avenue,Sydney,89853,(289) 604-7269,(394) 630-8751,Vivamus@aclibero.org,2014-08-22 19:21:06,Macromedia,,Mrs.,In nec orci. Donec nibh. Quisque nonummy ipsum non arcu.,"Weber, Benedict",5.0
7,Sharp,Garrison,Ap #346-3022 Sit Rd.,Dolgellau,316958,(664) 754-1494,(527) 803-6983,blandit@lobortisnisi ca,2014-03-25 10:37:05,Macromedia,,,"porta elit, a feugiat tellus lorem eu metus. In lorem.","Sharp, Garrison",22.0
8,Neal,Brianna,"P.O. Box 193, 4311 Non, Rd.",Varanasi,3652,(364) 859-9736,NULL,tellus.nonPellentesquehabitant.org,2014-11-15 05:39:20,Borland,Subscriber,,eu sem. Pellentesque ut ipsum ac mi eleifend egestas. Sed,"Neal, Brianna",2.0
9,Perez,Blake,"P.O. Box 143, 2053 Aliquam, St.",K�nigs Wusterhausen,6412,562.842.0885,(831) 836-0631,ullamcorper Duis@pharetraNam com,2014-10-25 05:28:05,Apple Systems,,Dr.,"massa lobortis ultrices. Vivamus rhoncus. Donec est. Nunc ullamcorper, velit","Perez, Blake",0.0
10,Buckley,Gillian,"P.O. Box 475, 3406 Eleifend, St.",Lakewood,29909,(670) 427-4742,(535) 459-5367,venenatis adiamSed ca,2014-11-30 16:04:32,Chami,", Trial",,malesuada fringilla est. Mauris eu turpis. Nulla aliquet. Proin velit.,"Buckley, Gillian",52.0
11,Brady,Montana,"P.O. Box 502, 4093 Tincidunt Rd.",Castello di Godego,54630,(519) 638-0041,(867) 904-9735,euismod.enim@dapibusidblandit.org,2014-01-28 05:25:14,Microsoft,,,"natoque penatibus et magnis dis parturient montes, nascetur ridiculus mus.","Brady, Montana",13.0
12,Cote,Jacob,373-6640 Dolor Rd.,Collecchio,26866,(607) 102-4092,(146) 673-8576,molestie arcu@Craslorem ca,2014-04-12 00:32:36,Yahoo,Elite,,"aliquet vel, vulputate eu, odio. Phasellus at augue id ante","Cote, Jacob",35.0
13,Mendez,Germaine,9243 Ligula St.,Delmenhorst,1332,(685) 369-8676,(299) 388-5642,libero Proin@acmieleifend com,2014-05-28 02:35:57,Cakewalk,"Elite, Platinum",Ms.,aliquet. Phasellus fermentum convallis ligula. Donec luctus aliquet odio. Etiam,"Mendez, Germaine",6.0
14,Shannon,Moses,829-4991 Accumsan St.,Goderich,3734,+1 (676) 537-8998,,habitant morbi@nascetur ca,2014-01-31 13:40:19,Lavasoft,"Elite, Subscriber",,"justo. Proin non massa non ante bibendum ullamcorper. Duis cursus,","Shannon, Moses",21.0
15,Macias,Harriet,1704 Amet Ave,Ilkeston,68599,(182) 514-6349,(940) 110-8501,rhoncus.Proin@semper.com,2014-11-11 20:45:39,Finale,Subscriber,,"consectetuer, cursus et, magna. Praesent interdum ligula eu enim. Etiam","Macias, Harriet",31.0
16,Lopez,Ishmael,Ap #232-2486 Dui St.,Hérouville-Saint-Clair,951448,963.534.7962,NULL,necametorci co uk,2014-05-30 09:24:22,Altavista,"Subscriber, Trial",Ms.,"nunc nulla vulputate dui, nec tempus mauris erat eget ipsum.","Lopez, Ishmael",21.0
17,Graves,Kennan,894-2164 Ac Rd.,Sprimont,50-846,(833) 515-0451,(105) 820-1507,eu.tempor.erat@elit.co.uk,2014-09-17 10:57:11,Chami,,,ut quam vel sapien imperdiet ornare. In faucibus. Morbi vehicula.,"Graves, Kennan",22.0
18,Wright,Rogan,"272-5312 Orci, Street",Bridgnorth,98176,(384) 812-6185,(321) 645-7325,odiosollicitudin.edu,2014-12-28 11:34:29,Macromedia,,,id enim. Curabitur massa. Vestibulum accumsan neque et nunc. Quisque,"Wright, Rogan",63.0
19,Nichols,Walker,145 Mauris Av.,Bossut-Gottechain,84734,293.215.4327,NULL,sapien@Duis.edu,2013-10-24 12:37:14,Google,,,vitae purus gravida sagittis. Duis gravida. Praesent eu nulla at,"Nichols, Walker",9.0
20,Rowland,Raja,"P.O. Box 231, 817 Purus St.",Dro,7295,(891) 603-2789,(885) 121-8047,Integer.vitae.nibh@accumsan.edu,2015-06-03 04:54:01,Borland,Platinum,Mrs.,consequat dolor vitae dolor. Donec fringilla. Donec feugiat metus sit,,6.0
21,Rowland,Kyla,9083 Vitae Ave,Helkijn,70614,(736) 168-5181,(134) 555-9362,mi@vitaealiquet.net,2013-12-16 19:39:53,Apple Systems,,,"enim. Suspendisse aliquet, sem ut cursus luctus, ipsum leo elementum","Rowland, Kyla",6.0
22,Humphrey,Jamal,"P.O. Box 808, 4916 Augue Av.",Montefiore dell'Aso,0790,(985) 749-2499,(781) 718-9004,semdui,2014-06-05 21:10:44,Lycos,,Dr.,malesuada malesuada. Integer id magna et ipsum cursus vestibulum. Mauris,"Humphrey, Jamal",77.0
23,Booth,Kane,9729 Et St.,Moorsel,78871,+1 (852) 374-0150,,aliquam@aodiosemper.edu,2015-04-11 17:55:51,Apple Systems,,,orci. Donec nibh. Quisque nonummy ipsum non arcu. Vivamus sit,"Booth, Kane",110.0
24,Alvarado,,"P.O. Box 630, 3398 Sed St.",Angers,4165,(254) 645-5937,(508) 675-9131,nostra.per.inceptos@Quisqueornaretortor,2013-10-28 01:16:55,Sibelius,,,"magnis dis parturient montes, nascetur ridiculus mus. Donec dignissim magna","Alvarado, Dorothy",60.0
25,Frye,Cody,Ap #409-1562 Nec St.,Braunschweig,13587,(114) 902-6833,(545) 480-6428,nisl.elementum.purus@Donec.com,2014-02-05 19:43:00,Apple Systems,,,sem eget massa. Suspendisse eleifend. Cras sed leo. Cras vehicula,"Frye, Cody",12.0
26,Wolf,Mannix,156-236 Dui. Avenue,Invercargill,R3L 7C5,(324) 983-0412,(111) 201-4688,elit@velquamdignissim.co.uk,2014-09-02 23:10:43,Cakewalk,Platinum,,arcu ac orci. Ut semper pretium neque. Morbi quis urna.,"Wolf, Mannix",9.0
27,Craft,Kenyon,673-5337 Malesuada Rd.,Itzehoe,31617,(227) 734-6812,,Donec.luctus.aliquet@metusVivamuseuismod.ca,2014-12-03 17:38:21,Finale,,,"lectus rutrum urna, nec luctus felis purus ac tellus. Suspendisse","Craft, Kenyon",11.0
28,Duke,Maryam,"P.O. Box 386, 5684 Vestibulum Road",Klabbeek,22045,+1 818.556.6726,(691) 633-2544,orci.lobortis@aliquet.edu,2015-03-02 11:48:07,Borland,,Mrs.,eu nulla at sem molestie sodales. Mauris blandit enim consequat,"Duke, Maryam",6.0
29,Reilly,Keith,"794-2309 Vitae, St.",Grande Cache,4588IF,(220) 206-8518,,mus.Aenean@mauriseu.net,2014-02-07 06:39:06,Sibelius,,Ms.,"non, hendrerit id, ante. Nunc mauris sapien, cursus in, hendrerit","Reilly, Keith",11.0
30,Olsen,Ina,Ap #846-2349 Quis Rd.,Dion-Valmont,103283,+1 (717) 976-6589,(242) 966-1407,ac.urna@tincidunt.edu,2015-08-22 10:18:35,Apple Systems,Subscriber,,"enim. Sed nulla ante, iaculis nec, eleifend non, dapibus rutrum,","Olsen, Ina",-5.0
31,Gould,Naomi,174-5100 Molestie Rd.,Stintino,80888,858.619.5042,(353) 876-1600,cursus.a.enim@nisinibhlacinia.org,2014-05-15 00:58:44,Borland,,,"Aliquam tincidunt, nunc ac mattis ornare, lectus ante dictum mi,","Gould, Naomi",33.0
32,Callahan,Sybil,9587 Amet Rd.,Assiniboia,Y5X 1Z5,(225) 134-2981,NULL,sem ut cursus@nasceturridiculusmus ca,2014-03-29 08:43:01,Cakewalk,"Trial, Elite",Mrs.,"elementum sem, vitae aliquam eros turpis non enim. Mauris quis","Callahan, Sybil",5.0
33,Mcmahon,Kiara,"Ap #935-3447 Ornare, Rd.",Leval-Chaudeville,779044,(735) 773-7553,(131) 212-8048,neque.tellus.imperdiet@Quisqueporttitor.co.uk,2015-06-01 14:20:49,Microsoft,,,fames ac turpis egestas. Aliquam fringilla cursus purus. Nullam scelerisque,"Mcmahon, Kiara",41.0
34,Garza,Savannah,"P.O. Box 683, 2845 Semper St.",Calder,30300,(926) 825-6835,(902) 120-6773,euismod.in.dolor@nibh,2014-01-07 19:59:41,Borland,,Mrs.,"felis orci, adipiscing non, luctus sit amet, faucibus ut, nulla.","Garza, Savannah",97.0
35,Coleman,Bruno,"P.O. Box 136, 3366 Lobortis, Road",Walhain,6203,(927) 271-8515,,ornare egestas ligulapedesagittisaugue ca,2015-02-17 13:14:27,Borland,,,"justo nec ante. Maecenas mi felis, adipiscing fringilla, porttitor vulputate,","Coleman, Bruno",23.0
36,Marks,,572 Consequat Street,Jefferson City,5811,(261) 704-1754,,Fusce@DuisgravidaPraesent org,2015-06-15 21:23:01,Google,,,"quam, elementum at, egestas a, scelerisque sed, sapien. Nunc pulvinar","Marks, Sigourney",30.0
37,Osborn,Omar,"P.O. Box 775, 2359 Arcu. Rd.",Savona,N2L 6C0,652.498.1524,(392) 246-8312,vel vulputate@ullamcorperDuisat org,2014-01-09 02:38:50,Apple Systems,,,"vestibulum lorem, sit amet ultricies sem magna nec quam. Curabitur","Osborn, Omar",44.0
38,Fletcher,Christopher,7533 Ac Road,Villafalletto,414680,+1 (297) 581-2502,,Vestibulum.ut@orci,2015-09-02 16:57:39,Apple Systems,Trial,,ut eros non enim commodo hendrerit. Donec porttitor tellus non,"Fletcher, Christopher",47.0
39,Mccullough,Russell,"589-5529 A, Avenue",Molenbeersel,87609,(460) 364-8769,NULL,et.magna@metussitamet.edu,2015-09-17 10:46:25,Cakewalk,Platinum,Ms.,ultricies sem magna nec quam. Curabitur vel lectus. Cum sociis,"Mccullough, Russell",34.0
40,Burke,Shay,Ap #540-2394 Quam. Av.,Bhavnagar,5409,(552) 334-3709,NULL,eu.tellus.eu@pede.net,2014-02-12 13:12:59,Yahoo,"Platinum, Elite",,"tempor bibendum. Donec felis orci, adipiscing non, luctus sit amet,","Burke, Shay",11.0
41,Kline,,"P.O. Box 270, 6630 Odio Road",Forio,43611,(538) 111-1045,(742) 104-8433,lobortis@liberoMorbi.co.uk,2014-01-22 20:26:09,Lavasoft,", Platinum",,"montes, nascetur ridiculus mus. Proin vel nisl. Quisque fringilla euismod","Kline, Moses",43.0
42,Velez,Helen,Ap #885-7016 Lectus St.,Fishguard,85496,(697) 455-1172,(305) 386-3861,dapibus@porttitor.net,2015-08-11 09:01:48,Sibelius,,,"eu, placerat eget, venenatis a, magna. Lorem ipsum dolor sit","Velez, Helen",12.0
43,Watson,Avye,"P.O. Box 469, 7889 In Street",Tacoma,85849,(830) 472-0668,(117) 565-6694,venenatis.a.magnavarius.ca,2015-05-14 05:59:23,Macromedia,Elite,Mrs.,"mi lacinia mattis. Integer eu lacus. Quisque imperdiet, erat nonummy","Watson, Avye",52.0
44,Finley,Isadora,772-4638 Ipsum. Av.,Marneffe,241982,(442) 644-3128,(285) 320-6175,Lorem.ipsum@amet.com,2014-10-30 00:59:47,Sibelius,,Mrs.,"a, scelerisque sed, sapien. Nunc pulvinar arcu et pede. Nunc","Finley, Isadora",39.0
45,Maddox,Zachery,565-7942 Massa. Rd.,San Isidro de El General,87-138,597.451.8049,(466) 134-7057,Fusce@diamat.net,2015-05-11 20:00:01,Yahoo,,,"lobortis ultrices. Vivamus rhoncus. Donec est. Nunc ullamcorper, velit in","Maddox, Zachery",12.0
46,Stafford,Tad,1305 Molestie Road,Latur,73684,+1 (620) 465-8987,,enim.consequat@NullafacilisisSuspendisse.net,2014-11-30 11:16:28,Microsoft,"Subscriber, Trial",,"augue eu tellus. Phasellus elit pede, malesuada vel, venenatis vel,","Stafford, Tad",66.0
47,Lynch,Emerald,6509 Nullam Road,Wemmel,2185,(557) 478-7805,,tincidunt.orci.quis@ipsumsodales.co,2015-02-05 09:35:40,Yahoo,Platinum,,Phasellus vitae mauris sit amet lorem semper auctor. Mauris vel,"Lynch, Emerald",18.0
48,Jimenez,Neil,"P.O. Box 221, 9414 Iaculis Street",Ashburton,270717,(454) 110-7094,(530) 813-0482,Duis.risus.odio@vitae.org,2014-08-04 14:01:42,Yahoo,"Subscriber, ",,"penatibus et magnis dis parturient montes, nascetur ridiculus mus. Aenean",,75.0
49,Meyers,Laura,4022 Diam Av.,Carunchio,40120,+1 (645) 540-8433,NULL,quis.lectus.Nullamvulputatenisisem.net,2014-06-02 07:45:41,Macromedia,Platinum,Mr.,metus. In nec orci. Donec nibh. Quisque nonummy ipsum non,"Meyers, Laura",49.0
50,Robbins,Solomon,1467 Iaculis Av.,Woodlands County,39164-716,(365) 395-9830,NULL,molestie.sodales.Mauris@eusem.org,2015-02-10 08:44:52,Chami,Elite,Ms.,"odio vel est tempor bibendum. Donec felis orci, adipiscing non,","Robbins, Solomon",10.0
51,Whitaker,Iola,1175 Dolor Ave,Hamilton,07943,(116) 818-6035,(765) 874-8415,vitae.erat@nondapibusrutrum.ca,2014-12-04 23:15:13,Borland,Subscriber,,et ultrices posuere cubilia Curae; Phasellus ornare. Fusce mollis. Duis,"Whitaker, Iola",10.0
52,Peck,Jolie,Ap #203-9176 Ultrices. Av.,Penna in Teverina,3943,(896) 214-2147,(984) 280-8914,nunc.sed.pede@nonjustoProin.edu,2014-04-30 09:39:36,Chami,Platinum,,"aliquam iaculis, lacus pede sagittis augue, eu tempor erat neque","Peck, Jolie",25.0
53,Parks,,"P.O. Box 458, 5245 In St.",Blue Mountains,45605,(722) 572-0638,NULL,turpis.egestas.Fusce@ligula.ca,2014-03-31 01:49:40,Finale,,,"eu erat semper rutrum. Fusce dolor quam, elementum at, egestas","Parks, Omar",38.0
54,Spencer,Madonna,"P.O. Box 364, 2335 Ligula Rd.",Galzignano Terme,69564,923.926.5924,(655) 953-7291,vitae@nonvestibulumnec.net,2015-04-04 15:06:00,Yahoo,,,"nec ante blandit viverra. Donec tempus, lorem fringilla ornare placerat,","Spencer, Madonna",72.0
55,Santos,Portia,Ap #831-9335 Nunc Ave,Glendon,7267,709.727.4089,(750) 694-3263,,2015-04-14 07:38:15,Lycos,"Platinum, ",,dolor. Nulla semper tellus id nunc interdum feugiat. Sed nec,"Santos, Portia",12.0
56,Chambers,Laura,Ap #648-4910 Senectus Ave,Kasterlee,7890,(332) 165-0373,(438) 676-1622,magna Ut tincidunt@velfaucibus com,2013-11-12 06:18:28,Macromedia,"Platinum, Subscriber",Ms.,Duis dignissim tempor arcu. Vestibulum ut eros non enim commodo,"Chambers, Laura",67.0
57,Diaz,Emi,1060 Risus. Road,Whangarei,486077,(714) 407-2878,(404) 433-2799,magnamagnased.edu,2013-12-19 04:23:02,Adobe,"Platinum, Elite",,"Aenean egestas hendrerit neque. In ornare sagittis felis. Donec tempor,",,12.0
58,Small,Allegra,"Ap #948-7218 Ullamcorper, St.",North Dum Dum,6092,(600) 387-0414,(660) 399-3593,adipiscing.enim.mi@ligulaAenean.org,2014-10-08 04:00:26,Cakewalk,,Mrs.,"sodales. Mauris blandit enim consequat purus. Maecenas libero est, congue","Small, Allegra",23.0
59,Blackburn,,302-3831 In Av.,Dallas,20300,(787) 469-4808,(847) 582-7913,at velit@telluslorem edu,2014-10-15 19:30:12,Altavista,"Subscriber, Elite",,faucibus orci luctus et ultrices posuere cubilia Curae; Phasellus ornare.,"Blackburn, Lillith",16.0
60,Blair,Wendy,"P.O. Box 428, 5951 At St.",Aberdeen,3942,(169) 744-5710,(676) 668-9926,molestie@volutpat ca,2014-11-01 04:58:20,Altavista,", Elite",,"ultricies ligula. Nullam enim. Sed nulla ante, iaculis nec, eleifend","Blair, Wendy",20.0
61,Guthrie,Alexa,8518 Donec Rd.,Weiz,681163,(961) 308-5186,(643) 379-2464,est@duinec co uk,2015-07-27 20:12:27,Lavasoft,,Mr.,tincidunt aliquam arcu. Aliquam ultrices iaculis odio. Nam interdum enim,"Guthrie, Alexa",54.0
62,Anthony,Sydnee,492-4849 Sociosqu Road,Sint-Andries,3269,(192) 305-0972,(779) 442-0487,luctus.et.ultrices@pede.com,2014-03-14 16:50:44,Cakewalk,,Ms.,"Duis elementum, dui quis accumsan convallis, ante lectus convallis est,","Anthony, Sydnee",9.0
63,Herrera,Breanna,"Ap #163-7592 Cursus, St.",Anlier,8494IN,(923) 706-2838,(823) 327-6601,lorem@dolor.net,2015-06-21 13:53:15,Chami,Subscriber,,"consectetuer adipiscing elit. Aliquam auctor, velit eget laoreet posuere, enim","Herrera, Breanna",54.0
64,Wade,Marvin,7860 Odio Ave,Vilna,38288,(156) 695-7174,,non@at,2013-11-25 23:46:50,Altavista,,,consequat enim diam vel arcu. Curabitur ut odio vel est,,61.0
65,Mays,Oliver,7925 Convallis Street,Cabano,2633,(368) 582-6071,(364) 818-5694,malesuada.augue@risus.org,2015-07-09 19:01:11,Cakewalk,Platinum,,"montes, nascetur ridiculus mus. Proin vel nisl. Quisque fringilla euismod","Mays, Oliver",-4.0
66,Richard,Ginger,"P.O. Box 738, 9105 Porttitor Av.",Saarlouis,842594,(657) 742-6707,(826) 425-3557,gravida sagittis Duis@malesuadaInteger com,2014-11-13 22:46:45,Sibelius,"Subscriber, Elite",Mr.,tincidunt aliquam arcu. Aliquam ultrices iaculis odio. Nam interdum enim,"Richard, Ginger",65.0
67,Mcdonald,Keith,"P.O. Box 335, 2482 Orci St.",Sint-Genesius-Rode,84949,(163) 407-7831,,nonsagittissemperNam.com,2014-04-20 17:04:26,Apple Systems,,,"ligula tortor, dictum eu, placerat eget, venenatis a, magna. Lorem","Mcdonald, Keith",5.0
68,Wallace,Ethan,"P.O. Box 930, 2822 Nunc Rd.",Sint-Katherina-Lombeek,64557,(422) 499-6645,,aliquam@eleifendnecmalesuada.edu,2015-01-05 00:14:20,Macromedia,,Mr.,Vestibulum ante ipsum primis in faucibus orci luctus et ultrices,,10.0
69,Merritt,Moses,"P.O. Box 297, 5314 Nec Rd.",Rachecourt,51419,(721) 423-5727,(133) 640-5059,vel.estauctor.co.uk,2013-10-06 06:24:03,Apple Systems,,,"mauris ipsum porta elit, a feugiat tellus lorem eu metus.","Merritt, Moses",17.0
70,Doyle,,574-6695 In Road,Albi,74696-822,(534) 669-8096,(477) 457-3573,morbi@nibh.co.uk,2015-07-13 06:09:09,Lavasoft,,,erat vel pede blandit congue. In scelerisque scelerisque dui. Suspendisse,"Doyle, Ezekiel",9.0
71,Joyce,Taylor,"P.O. Box 785, 4789 Felis. Rd.",Rivello,77401,(117) 158-5230,(974) 870-5720,lacinia.vitae@imperdietnon.edu,2015-07-26 16:40:13,Chami,Subscriber,,"lorem ipsum sodales purus, in molestie tortor nibh sit amet","Joyce, Taylor",10.0
72,Figueroa,Benedict,"Ap #246-3343 Ornare, Rd.",Bourges,3636,(450) 923-3518,(282) 589-1112,,2014-08-05 23:44:20,Yahoo,Elite,,dolor. Donec fringilla. Donec feugiat metus sit amet ante. Vivamus,"Figueroa, Benedict",0.0
73,Dotson,Cathleen,508-2194 Tellus. Rd.,Comblain-Fairon,90108,(767) 482-8893,(286) 780-2988,egestas lacinia Sed@enimEtiam ca,2014-10-23 12:09:11,Borland,,,diam dictum sapien. Aenean massa. Integer vitae nibh. Donec est,"Dotson, Cathleen",82.0
74,Farley,Aurelia,475-739 Viverra. Rd.,Gresham,19671-596,+1 (732) 377-3570,(837) 929-4923,,2014-08-11 17:27:49,Adobe,,,"posuere at, velit. Cras lorem lorem, luctus ut, pellentesque eget,","Farley, Aurelia",24.0
75,Summers,Octavius,"205-2117 Tempor, Street",St. Albert,60018,(807) 319-6707,(884) 611-1572,purus.mauris@metus.com,2014-01-20 11:01:18,Altavista,Trial,,in faucibus orci luctus et ultrices posuere cubilia Curae; Phasellus,"Summers, Octavius",-3.0
76,Cooley,Susan,"P.O. Box 341, 8629 Morbi Rd.",Buggenhout,5239,(817) 428-2533,(285) 248-4761,,2013-10-14 02:36:05,Google,,,libero. Proin mi. Aliquam gravida mauris ut mi. Duis risus,"Cooley, Susan",6.0
77,Lowery,Evangeline,Ap #293-5949 Blandit Av.,Swadlincote,23-246,+1 512.733.0573,,Vivamus.rhoncus@pharetra.com,2014-11-06 12:59:05,Apple Systems,,,"dis parturient montes, nascetur ridiculus mus. Donec dignissim magna a","Lowery, Evangeline",20.0
78,Sims,Desiree,5376 Euismod St.,Gagliato,4940,(918) 759-3876,(196) 824-1039,Pellentesque.tincidunt@at.co.uk,2014-10-30 01:24:17,Microsoft,,Ms.,"libero est, congue a, aliquet vel, vulputate eu, odio. Phasellus","Sims, Desiree",23.0
79,Boyd,Bernard,Ap #421-473 Dictum. Rd.,Fleurus,2667,+1 (664) 355-3555,(874) 918-2233,Donec.egestas.Duisaliquet,2014-12-25 06:38:10,Google,,Mrs.,"enim, sit amet ornare lectus justo eu arcu. Morbi sit","Boyd, Bernard",3.0
80,Hurst,Iris,"P.O. Box 980, 5891 Fringilla Ave",Pelotas,9496,+1 (682) 283-7999,(687) 143-1137,tincidunt@aliquetvelvulputate.org,2015-09-29 01:04:07,Yahoo,", Subscriber",Dr.,"nec, eleifend non, dapibus rutrum, justo. Praesent luctus. Curabitur egestas","Hurst, Iris",9.0
81,Simpson,Honorato,"P.O. Box 805, 2881 Donec Street",Zweibr�cken,31978,(799) 144-4156,(134) 933-6203,dolor.Donec.fringilla@purusDuiselementum.com,2014-06-13 22:18:08,Apple Systems,Platinum,,"sem semper erat, in consectetuer ipsum nunc id enim. Curabitur","Simpson, Honorato",27.0
82,Delaney,Erasmus,4812 Duis Rd.,Concepción,QB9W 5UY,(299) 394-3084,(303) 679-6883,ac.risus@Sedeget.net,2014-02-01 15:56:27,Chami,,,"ac metus vitae velit egestas lacinia. Sed congue, elit sed","Delaney, Erasmus",41.0
83,Holland,Justine,550-1918 Consectetuer Street,Maaseik,80968,(670) 832-1550,(852) 904-1578,Duis.dignissim@dui.co.uk,2014-04-19 16:03:06,Cakewalk,,Mrs.,eu eros. Nam consequat dolor vitae dolor. Donec fringilla. Donec,"Holland, Justine",49.0
84,Shaw,Keelie,"P.O. Box 329, 3645 Phasellus Street",Forchies-la-Marche,41606-775,(683) 698-2649,(815) 824-3554,UtNunc co uk,2015-08-05 22:08:42,Microsoft,", Platinum",,"libero. Donec consectetuer mauris id sapien. Cras dolor dolor, tempus",,97.0
85,Donovan,Hakeem,"P.O. Box 819, 9702 Lacinia St.",Hillsboro,7591JZ,(395) 930-9387,(633) 912-7544,imperdiet.ornare.In@aodiosemper.edu,2015-04-06 00:45:31,Lycos,Elite,,fringilla euismod enim. Etiam gravida molestie arcu. Sed eu nibh,"Donovan, Hakeem",30.0
86,Estrada,Lois,737-5609 Turpis. Road,Llangefni,P0K 7T3,+1 (337) 899-4490,(379) 765-3000,molestie@seddictum.com,2015-01-24 09:50:32,Cakewalk,"Platinum, ",Dr.,"lacinia at, iaculis quis, pede. Praesent eu dui. Cum sociis","Estrada, Lois",-1.0
87,Manning,Amity,"P.O. Box 952, 7151 Tortor. Av.",Uberaba,1634,(846) 988-7083,(436) 918-1474,non@tinciduntneque.net,2014-10-03 17:56:53,Macromedia,Subscriber,Ms.,"non, vestibulum nec, euismod in, dolor. Fusce feugiat. Lorem ipsum","Manning, Amity",17.0
88,Sherman,Laura,533-1293 Diam Rd.,Chatteris,72918,(597) 969-1969,(475) 934-2933,Mauris.nulla.Integer@milaciniamattis.org,2014-07-08 05:00:09,Lycos,", Elite",,"sed dui. Fusce aliquam, enim nec tempus scelerisque, lorem ipsum","Sherman, Laura",9.0
89,Robinson,Kamal,134-5538 Eros Ave,Marke,38458,(128) 374-1071,(992) 612-5565,eu.dolor@vitaediamProin.co.uk,2014-02-09 13:25:28,Google,,,"parturient montes, nascetur ridiculus mus. Donec dignissim magna a tortor.","Robinson, Kamal",14.0
90,Moses,Ella,Ap #378-5176 Cras Av.,Dollard-des-Ormeaux,T6J 6P9,(378) 438-1322,(506) 968-3458,dictum@liberoDonecconsectetuer ca,2014-10-20 10:44:45,Yahoo,Platinum,Ms.,"nostra, per inceptos hymenaeos. Mauris ut quam vel sapien imperdiet",,69.0
91,Patrick,Declan,"P.O. Box 526, 4299 Natoque Street",Caen,53970,(750) 846-8454,,cursus.et@magnaa.net,2014-07-27 06:51:45,Cakewalk,Elite,,"Cras dictum ultricies ligula. Nullam enim. Sed nulla ante, iaculis","Patrick, Declan",9.0
92,Christensen,Brandon,"P.O. Box 637, 4260 In Avenue",Conca Casale,7041,+1 (382) 610-3332,(118) 661-5806,aliquam.eu@sitamet.net,2015-03-29 10:28:55,Microsoft,Subscriber,Mrs.,"amet massa. Quisque porttitor eros nec tellus. Nunc lectus pede,","Christensen, Brandon",78.0
93,Travis,Tucker,6066 Cras Street,Termeno sulla strada del vino/Tramin an der Weinstrasse,4711,+1 (738) 839-8734,(882) 272-2562,purus@estac.org,2015-06-03 21:01:47,Altavista,Platinum,,dolor. Quisque tincidunt pede ac urna. Ut tincidunt vehicula risus.,"Travis, Tucker",106.0
94,Conrad,Yael,3390 Mauris St.,Stralsund,P7G 0Z6,(948) 369-3540,(889) 283-2314,auctor@magnaNamligula.ca,2014-01-01 14:07:17,Google,Platinum,,"Nunc ut erat. Sed nunc est, mollis non, cursus non,","Conrad, Yael",17.0
95,Foley,Wylie,489-1859 Natoque Street,Tuticorin,71617,(135) 662-3040,(468) 897-4965,,2014-10-30 08:13:13,Adobe,Elite,,Sed nec metus facilisis lorem tristique aliquet. Phasellus fermentum convallis,"Foley, Wylie",26.0
96,Park,Moses,Ap #588-654 Tortor Ave,Vremde,74-829,(467) 929-7164,(151) 668-6056,posuere.cubilia.Curae@rutrumjusto.org,2014-03-10 01:48:17,Adobe,Trial,,Nulla eu neque pellentesque massa lobortis ultrices. Vivamus rhoncus. Donec,"Park, Moses",19.0
97,Morales,Aretha,"P.O. Box 131, 4120 Laoreet St.",Humbeek,06149,+1 (395) 903-1509,(290) 723-9093,,2014-04-13 22:47:24,Cakewalk,", Subscriber",Dr.,sapien. Nunc pulvinar arcu et pede. Nunc sed orci lobortis,"Morales, Aretha",19.0
98,Holland,John,"P.O. Box 603, 7457 Duis Ave",Grezzana,X28 2XH,(355) 535-9406,NULL,parturient.montes.nascetur@magna.edu,2015-06-11 09:59:53,Sibelius,"Subscriber, Trial",,odio. Phasellus at augue id ante dictum cursus. Nunc mauris,"Holland, John",-24.0
99,Castaneda,Lani,7609 Magna St.,Fort William,27-320,(890) 184-7685,(293) 192-9500,Donec@velitSed ca,2014-11-25 05:17:08,Cakewalk,Elite,,non dui nec urna suscipit nonummy. Fusce fermentum fermentum arcu.,"Castaneda, Lani",9.0
100,Hayes,Kelly,6980 Sem St.,Paris,87748,(742) 129-4078,,eget.ipsum@Nullamsuscipitest.edu,2015-01-14 23:32:25,Varius Ultrices Institute,,,"at, nisi. Cum sociis natoque penatibus et magnis","Hayes, S. Kelly",-1.0
101,Moody,Justin,Ap #577-2350 Porta Ave,Brechin,06371-882,(447) 958-0787,(825) 508-9826,luctus.aliquet.odio@facilisis.org,2014-09-27 17:42:15,Orci Consectetuer Euismod Limited,"Platinum, Trial",Dr.,Sed auctor,"Moody, Justin",51.0
102,Estrada,Yael,"P.O. Box 830, 5999 Commodo Avenue",Savannah,O7A 0IF,(474) 363-9888,(186) 338-5583,neque sed dictum@purus ca,2013-11-21 23:08:46,Gravida Aliquam Tincidunt Institute,,Mr.,ultrices. Duis volutpat nunc sit amet metus. Aliquam erat,"Estrada, F. Yael",14.0
103,Burch,Athena,"P.O. Box 599, 5514 Nisl St.",Laives/Leifers,59899,+1 (532) 433-7387,,ante@Morbiquis.ca,2014-01-29 02:48:55,Faucibus Morbi LLP,Elite,Ms.,"lacus. Nulla tincidunt, neque vitae semper egestas,","Burch, Athena",7.0
104,Fletcher,Quinn,Ap #981-7726 Amet Road,Alva,434558,(938) 274-2556,,magna.Suspendisse.tristique@semperet.net,2014-03-29 08:52:27,Sit Corporation,"Elite, Subscriber",Mr.,"vestibulum, neque sed dictum","Fletcher, Quinn",66.0
105,Savage,Vivian,"P.O. Box 494, 2858 Arcu Road",W�rzburg,29743,(880) 449-2442,(246) 214-2660,,2014-01-06 17:33:06,Cubilia Limited,"Trial, Elite",Ms.,sed libero. Proin,"Savage, J. Vivian",9.0
106,Wooten,Sade,193-4020 Nec Street,Houtain-le-Val,831177,(390) 219-9595,,odio a@a com,2015-08-04 03:11:48,Penatibus Et Magnis Associates,"Subscriber, Platinum",,nisi,"Wooten, V. Sade",18.0
107,Barr,Micah,"P.O. Box 637, 6687 Lobortis Street",Tribogna,87845,(793) 539-1161,(389) 588-9694,,2014-03-04 12:37:10,Orci Ut Limited,,Ms.,"odio a purus. Duis elementum, dui quis accumsan","Barr, Z. Micah",5.0
108,Buck,Caleb,Ap #518-8827 Eget Avenue,San Giacomo degli Schiavoni,21712,(995) 518-5337,(968) 194-5494,Nunc@accumsan edu,2014-11-04 07:36:34,Nonummy Ac Feugiat Industries,,Mrs.,habitant morbi tristique senectus et netus et,"Buck, Caleb",12.0
